name,title,date,video_url,view_num,likes_num,unlikes_num,comments
자본주의에서 부자가 되는 법칙 (백석현 이코노미스트),자본주의에서 부자가 되는 법칙 (백석현 이코노미스트),2021. 5. 10.,http://www.youtube.com/watch?v=55osn87i7TQ,"조회수 84,641회","좋아요 1,398개",싫어요 49개,"실패가 두려워 도전하지 못 한다면 당신은 이미 실패다.|아무것도 안하면 아무일도 일어나지 않는다|하루만에 800만원 딸수도 있지만 800만원 증발하는곳이 코인시장이지|밥 먹으면서 듣다가 세버리지에서 뿜었어요 ㅠㅠ|개미는 우량주 여러 종목 분산투자에 공감합니다^^|그래도 오늘은 주식시장이 좋아서 하루종일 기분이 좋더라ㅋㅋ|오늘 켜튼색 젤 맘에 드네요 ㅋㅋ|억단위의 큰 시드머니가 없는 개미들은 여러종목을 나눠서 위험부담을 줄이고 15~20% 정도 수익률이 되면 수익실현하면서 자본을 늘리는게 더 현실적인 방법인것같아요~한종목에 몰아넣으면 내려갈때 심리적부담이 크고 욕심이 생겨 슈팅왔을때 오히려 못 팝니다~|감사합니다 ^^|간절한 내 맘속이야깈ㅋㅋㅋㅋ|주변에서 오늘만 같아 달라하던데...주식시장ㅎㅎ
좋은 영상 감사합니다!^_^|코인 가즈아 왈! 왈!|난 그냥 신사임당이 넘 멋있다요|많이 배워갑니다^^|싱크가 안맞아서 보기가 힘드네요|오늘도 감사히 잘 배우겠습니다^^|한달전에 이 영상 보고 두 종목 넣었는데 지금 12%올랐어요. 대학생이라 큰돈을 투자한건 아니지만 수익이 생기니 기분은 좋아요!|소외된 주식 지겹다…|유익한 정보 잘 들었습니다. 또 나와주세요~|오늘도 맛난 실전지식 나눠주셔서 고맙습니다=^^=|나쁜뜻은 전혀아니고 팬이어요.
'송아지눈' 자꾸 연상됨|투자란 내가 바라는 미래에 한 표를 선사하는 것이다
라는 말이 생각나네요. ^-^ 신중하게 투자할게요.|하수는 그냥 펀드 투자 합시다.|코인 폭락할때 줍줍하면 되나요 이더 200% 수익률인데 너무 소액넣어서 안타까워요...
미국Etf는 장기간 냅둬도 될까요|투자는 말그대로 투자다. 중국에 투자하면 일대일로와 공산당, 독재, 대만/홍콩/미얀마 쿠데타에 투자하는 길이다. 중국투자는 하지 말자.|16:00 원유레버리지ETN 사고는ㅡ 레버리지의 문제보다는 원유레버상품으로 과도하게 자금이 몰리면서 증권사 LP가 ETN의 괴리율을 제대로 관리 못할정도로라 거래를 정지까지 시켰었죠. 괴리율이 80~90%까지 치솟았던게 문제였습니다. 
관리가 안되어서 괴리율이 80%가 넘는다는걸 지속적으로 언론등을 통해 경고했는데도 차익먹겠다고 들어간 사람들도 문제이긴 합니다만. 
50%가까이 하락해서 레버리지가 녹는 그런 점과는 논란이 다른 문제였어요.  아마 신사임당님도 ETN 괴리율 관리 제대로 안된 대표적인 예라서 물어보신것 같은데,  녹는다는 말이 틀렸다는 건 아니지만, 당시 원유레버상품의 논란점과는 다르게 말씀하셔서 한마디 적고갑니다.
고민이 많아지는 장입니다~ 영상 잘보고 갑니다. 감사합니다.|저만 싱크 안맞나요 ㅠㅠ|말을 너무 더듬더듬 ㅡㅠ|우리나라 주식시장은 기관이 망친거예요. 그동안 펀드 망친게 너무 많아요.|너무 원론적인 이야기임. 분산투자는 서민한테 해당안된다. 개별종목 씨드 몇천씩 박아서 할 수 있는거 아니면 기다리다가 개별종목별 사이클 끝나면서 이도저도 안돼. 길게봐도 똑같아 푼돈은 결국 푼돈이다. 좋은 회사에 집중투자해서 분산투자할 수 있는 자금을 먼저 만들어야지....
못기다리고 파는게 문제인건 맞음.. 길게 기다리질 못함 주변 사람들만 봐도, 한 2-3개월 들고있다가 지친다고 팔아버림. 

자기가 어느 자리에서 들어갔냐도 중요하지. 주식은 집중투자와 누울자리를 보고 눕는게 다다.. 그거만 잘해도 돈번다..|부자가 되려면 딱 2가지입니다.
‘도전’ 하거나 ‘도지’ 하거나,,,|정말 부자가 되고싶어요....돈이 없으면   병원도 제대로 못갑니다.|코인 만원으로 시작해서 지금 12만원 됬둥ㅋ 난 천재야|삼성전자를 꾸준히 모아가는 장기투자자들의 네이버 카페 삼장배투를 소개합니다! 함께 꾸준히 삼전을 모아가실 장기 투자자분들을 초대합니다 삼장배투를 검색해주세요|걍 etf 사면 안됌??|코인이 답이다. 주식으로 1억으로 굴린 연수익률 보다 코인시장에서 2천만원으로 2주 굴린 수익률이 훨씬 뛰어나다."
2021년 무주택자가 유리한 이유  (이주현 월천재테크),2021년 무주택자가 유리한 이유  (이주현 월천재테크),2021. 5. 9.,http://www.youtube.com/watch?v=55osn87i7TQ,"조회수 140,799회","좋아요 2,296개",싫어요 169개,"아 그러면 안되는데 변곡점에서 왜 임플란티드키드 생각나는지.. 큰일입니다|집사면안되는 사람이 저일까싶어서 들어왔어요|떨어질때는 가슴이 쓰라리겠지만 좋은 동네로 갈아탈기회로 봐야겠지요 ㅎㅎ 주가가 떨어질 때 오히려 매수해야 하는 것처럼|선댓글 후감상 감사합니다|니가하면 투기 내가하면 투자.
요즘 세상에 투기가 어디있나.
권력형 비리와 내부자료 유용이 있을 뿐.|좋은 말씀 감사합니다.    내가 2배속  재생을 해놨나 했습니다. ㅎㅎ|무주택자 저네요~ㅜㅜ|요즘 같은 시기에 청약으로 집사는게 가장 저렴하긴 해요~ 부동산도  공부하듯이 팟캐나 유튜브도 들어야 하는군요😃|헉, 제 얘기 하는건 아닌지 바로 시청완료 해야겠네요. 미룰 수 없는 상황. ㅋㅋㅋ|천카콜라 ㅇㅈ합니다|청약제도 개선이답임|오늘도 잘 배워갑니다|뭔소리지; 그냥 자기 얘기?|월천대사님 좋은 이야기 잘 듣고 갑니다. ㅎㅎ|일단 실거주 목적 청약으로 도전하겠습니다!
좋은 영상 감사합니다^_^|질문 있어요 제주도 거주중인데 제주도에서
주택청약 가능할까요?|무조건 사라했던 월천이 무주택자들에게 두가지
경우를 제시했다면,
지금은 집살때가 아니라고
말하는것같은 늬앙스?|말씀이.너무빨라요ㅠㅠ|지금 비록 저처럼 돈,  집이 없는 사람도 희망을 가지고 살아도 되겠죠ㅎㅎ 강의 잘 배웠습니다😄|아하~|무주택자 정보 유료사이트좀 알려주세요|어쨋든 무주택자여서 
내집없음에 맘이 불안한건 사실입니다|실거주는 떨어져도 상관없다고 생각하는 1인 있어요.  집값 오르는거 안좋아 합니다. 세금만 많이 내야하고|드라마처럼 흘려듣지 마라는 점에 공감되네요.
저도 그렇지 않았나 싶고 좀 더 디테일한 공부를 해야겠어요.|5등|20, 30대는 주식이나 부동산 같은 재테크에 목숨을 걸어야 하는 시대입니다.
부동산이 단기간에 너무 많이 올라서 진입 장벽이 높아졌기 때문에 시드머니를 만들기 위해서 리스크가 다소 크더라도 주식 시장에도 관심을 가져야 하는 각박한 상황입니다.
 
다만 힘들다고 불합리하다고 손놓고 있으면 안되고
내가 처한 상황을 제로로 놓고 지금 상황에서 내가 할 수 있는 최선의 결과를 얻을 수 있게 노력하고 도전해야합니다.
저뿐만 아니라 많은 분들 힘드시겠지만 포기하지말고 파이팅하셨으면 합니다|ㅠㅠ|진짜 쓰잘대기없는 이야기가 너무많네요 결론은 어렵지않은 시장이고 선택은 본인의 몫이다 가 요약입니다|벼락거지 여기 하나 추가요~|이분말 들으니까 맘이 더 급해지네요.. 목돈도 없고 대출도 안되는데 코인이나 열심히 해야겠어요 ㅠㅜ|영상이 새로 올라온 건가요? 전에 봤던것 같은뎅 😵|맞는 말씀... 공부를 제대로 하고 실행에 옮겨야 한다.|스승님은 구만수박사님인가요? ㅎㅎ|의견은 다를수있는데 암튼 제테크인들 홧팅|뭐가 유리하다는 건지,  도대체 논점이 없네요. 끝까지 들었는데 왜 들었는지 모르겠네요. 욕안하는데 욕하고 싶어집니다. 내 이십분 돌리도~~~~~~|대표님최고|집이 필요한가|가점 65입니다. 기다려야 합니까?|실거주용이여도 자기 집값 내려가면 
너무 슬플 거 같아요… ㅜㅜ|진짜 부동산 하려는 사람들에게 축은지심 갖고 솔직한 이야기해주고 하드캐리해주려고 하는 분이죠. 덕분에 갈아타기했습니다. 늘 감사해요!|제목이 바뀌엇메요|아따 속시원하게 말씀 너무 잘하심ㅋㅋㅋㅋㅋ|내 집 마련하는 것이 목표가 되어버린 세상
힘들지만 다들 화이팅입니다 💪🏻|빨라서안들려요|청약 점수 가망없으면 집사야죠뭐..저는 임대주택들어가기싫어요|이런말 해주는 사람 없어요
뼈때리는 말씀이네요
쪽집게 강의|걍 살고싶은동네돈주고사자|관상 이마에 스트레스가 있네요.|지금이 고점이라면 2년후 하락장올태니 준비를..|앗 1등..?!|행동하지 않고 유튜브 영상만 보시면 안 됩니다. 2021년 당장 시작하세요!|많은 도움이 되네요~ 감사합니다^^|태아 1명 신특/생초 가능한 부부입니다. 지방인데 계속 기다리면서 청약을 넣어보는게 맞겠죠?
전세 살면서 힘드네요.. ㅠ|입지좋은데 들가면 상관없소|2021년도 부동산 대폭락 사태 온다. 2022년도(내년도) 국가 부도사태 터진다|시간 아껴드립니다.
18분간의 이야기를 요약하면, ""부동산 시장 쉽지 않은 상황이다"" 정도가 됩니다.

이런 저런 이야기가 더 나오지만 그 외에는 실제로 부동산 투자에 활용할 수 있는 유의미한 정보는 없으니 전체 영상 보지 않으셔도 됩니다.|감사합니다^^|1분전 못참지|21년도는 청약의 해인거 같네요 : )|실거주고 뭐고 부동산이나 주식이나 똑같은 자산인데 주식은 고점에 사서 물리면 투자자 잘못이고 부동산은 고점에 사서 물리면 정부잘못이냐? 비싼데도 샀으면 손해보는게 당연한거지|사셔야되요 단, 철저한 공부후에|정부 실패를 예측하고 집을 샀더니 정말 다행이네요 ^^|집없는 사람은 그냥 사세요 제발좀 떨어질걸 왜 걱정해요? 쌀때 사면 좋지만 내가 당장 살집없는게 더 스트레스 입니다|집은 거주의 목적 
차는 이동수단의 목적
화폐는 교환수단의 목적 
목적에 +알파가 없는 세상에 살고파|일요일 저녁~^^|역시 유료강의랑은 내용이 많이 다르군요 ㅎㅎ
유료강의에서는 특정부분 찍어주시던데요|버블은 자본주의 원동력 입니다

꼭지냐 아니냐의 판단은
시장 참여자 모두가 돈을 벌었다고 하면서
다른 재화구매가 폭발적으로 늘어나면
즉 소비심리가 높아지면 꼭지라고 생각합니다|집을 사야 합니다..돈 있는 사람 집 없는 거 봤나요? 집은 언제 가도 비쌉니다 절대 싸질 수 없어요..집이 있어야 다른일도 편해 집니다|몇번 떨어지긴했지만 반등해서 우상향으로 오르는거보면 안사신분 후회하고 벼락거지되었죠|열기가 뜨거운거 보니 하락은 없을듯.
집에 미친건지. 돈에 미친건지. 실거주 드립은 아주 사람 토악질 나오게 만듬. 정부탓 하지말고 지금이라도 사세요. 정부탓 하는거 보면 순진한건지 멍청한건지.|수요자가 없으면 가격은 내려갈 수 밖에 없습니다
사지마세요ㅎ|모든 부동산 규제를 한방에 없애야 함...

부동산에 과세할 수 없다고
헌법으로 정해야 함...|가로 보기를 하면 화면이 왜 짤릴까요?|말이 심하게 빨라서 듣기가 어렵습니다|너무 맞는 말씀만이라서 무릎을 탁! 치고 갑니다|제 경험으로는 하락기엔 실거주 만족도 이딴거 없습니다. 새 아파트 살아보고 싶어 이사 가고 싶어도 집이 안팔려 이사도 못가고, 자산이 줄어드는건 보이는데 더 떨어지면 더 가난해 지는데 어쩌지 하는 고민이 팽배했던게 그리 먼 과거가 아닙니다.  8년 전 제가 그랬거든요... 그 땐 전세 사는 친구들이 불(웠습니다 ㅜㅜ|2|집값이 올라도 세금만 더내지 달라지는거없다고 하는 인터넷 글들이 더러 보이는데 여기에 동조하는 댓글이 너무 많아서 놀랐음.. 내가 산 집값이 2배가 오르는데 세금걱정을 한다..? ㅋㅋ|12|이러지도 저러지도 못하는 1인 여기추가요ㅜㅜ"
일하지 않아도 평생 월 500 버는 방법 (소수몽키) [경제적 자유를 얻는 현실적 방법],일하지 않아도 평생 월 500 버는 방법 (소수몽키) [경제적 자유를 얻는 현실적 방법],2021. 5. 8.,http://www.youtube.com/watch?v=55osn87i7TQ,"조회수 395,332회","좋아요 7,739개",싫어요 170개,"들어올 수 밖에 없는 제목...|소몽 유튜브로 미국주식을 시작하고 현재 1년넘게 투자중입니다
배움을 주셔서 너무 감사드려요!!!|가장 큰 리스크는 어떤 리스크도 취하지 않는 것이다.|우앙 제 최애 유튜버ㅠㅠㅠㅠ이 조합 최고|와~ 소몽님이네요!!
미국 주식 입문하게 해주신 분.
쉽게 설명해 주시고 분석력 뛰어나셔서 많은 도움 받고 있어요~|저는 작년에 소수몽님 알게되면서 주식도 처음하는 사람이 3월 저점에 미국주식을 투자할수 있었어요. 정말 인생의 은인!!! 감사합니다 ♡♡♡♡♡|펜 던졌엌ㅋㅋㅋㅋㅋ|월500을앉아서 버는법 = 10억을 넣어두면 된다|내 노후준비를 위한 배당금 쌤! 소몽&앙찌
2억 > 월100, 1억 > 월50
10억 > 월500 가즈아~~|와.. 소몽님 여기서 보니까 반가워요. 출연 축하드려요~|크,,, 둘다 똑돌이들 아주|월 162만원이 목표였다니 정말 구체적인 목표를 정하고 시작하셨네요. 배우고가요 
영상잘봤어요 감사합니다!|우왕ㅎ 제가 좋아하는 두 분의 투샷을 보다니 >< 좋은영상 감사합니다:)|힘든시절 주로봤던 두 유튜버|굉장히 흥미로운 내용이네요~ ㅎㅎ
10억있으면 월500 배당
부동산보다는 관리하기 편하고 좋을 것 같네요~|1억이 읍따 ㅠ|제목이   쿡쿡~~~들어오네요!|임당형 리액션 지리십니다 형님|소수몽키님 영상 평소 잘 보고 있는데 반갑네요 ^^ 좋은 영상 감사합니다.|코로나시대~코로나에대해궁금하신분들은
*코로나 미스터리*
책을 꼭 읽어보세요
궁금증이 싹 다 풀립니다~~~|오늘 로또 당첨되면 배당주 해외주식 12억어치 삽니다... ☺️☺️|로또 되면 좋겠다..|진짜 소몽님은 나만 알고싶은 선생님 ㅠㅠㅠㅋㅋㅋㅋㅋ|공부안해도 되는주식 오~~~|배당주로 노후준비 해보고 싶네요😀 알찬방송 그리고 좋은 애기 많이 해주신 주분 감사합니다 ~^^|12억 모아서 배당주 할게요.. 아직 12억이 없어|소몽님, 최곱니다~~|1억으로 월50 연 600이면 수익률이...|고속도로 통행료로 배당금 주는
맥쿼리인프라 <<이런 배당주도 우량하죠^^|9:00부터 신사임당 리액션보소~~~ 
볼펜도 집어던지시고|저도 이런식으로 모아가는데 1년 지나니 10%정도대 수익율인데(포트폴리오)+배당금도 있어서 재투자 하니 점점 더 수익률이 좋아지고 있네요|미국주식으로 성공하기!|두분 감사합니다 🙏 잘봤습니다^^|해외주식은 소수몽키! 신사임당님 최근에 주식에 관심이 점점 많아지고있는게 느껴집니다 승부사 기질도 있으시니 큰돈 버실거같아요 ㅎㅎ|제가 좋아하는 소몽님ㅎㅎ|휴~숨차네요. 빨리오느라~|저랑 같은마인드ㅎ배당투자가 답이다|소몽님 반가워요 ㅎ|배당금이 노후자금이지ㅎㅎ ᆢㅋㅋ|1등!!|소몽!|미국배당이 정말 매력적이죠ㅎ|소몽님 여기에서 뵈니 너무 반갑네요|흡연자는 담배값으로 KT&G 주식을 사세요. 배당 꽤됨..|정말 유익한 정보 감사해요~♥ 은퇴를 앞두고 있는 사람으로서.. 건물? 배당주? 고민하던 중인데!!! 감사합니다^^|그럼 분기마다 천오백이 나오는거네요|우와 소수몽키님 완전 찐팬입니다. 미국주식 종목도 잘 알려주시고 저점도 잘 알려주시고 장기로 가져가야할 종목도 완전 잘 알려주셔서 정말 좋아합니다. 이번 영상 더욱 반갑네요! 감사합니다!!!|가만히 보니 두분책.. 다 사서 읽었네요 ^^|미국지수 etf는 어떤가요?|무서운회사ㅎㅎ 그럼저는 아마ㅈ... !|9:05 갑자기 펜 던지셔서 놀램... ㅋㅋㅋ|ㄴㄴㄴㄴㄴㄴㄴㄴㄴㄴㄴㄴㄴㄴㄴ나는 배당 너무 적어 주식으로 불려서 한60먹고나서 부동산 월세받고 남는돈 배당을 받던지 하는게 훨 나은듯 30년 남았다ㄷㄷ|ㅋㅋㅋㅋㅋㅋㅋㅋㅋㅋㅋㅋㅋㅋㅋㅋㅋㅋㅋㅋㅋㅋㅋㅋㅋㅋㅋㅋㅋㅋㅋㅋㅋ|12억이 있으면 경제적 자유를 얻을 수 있다..|하다보니 저는 작년부터 미국과 한국 월배당 수입이 500만원을 넘어가게 되었네요.  소수몽키님이 방송하기  몇년 전부터 비슷한 컨셉으로 투자를 진행하고 있는데, 이런 방법은 장기적으로 통하는 방법이라고 생각합니다.   지금은 포트에  MAGA 주식이 많아서  투자 자산 대비 배당 수익율이 낮기는 하지만 절대적인 배당수익도 중요하지만 전체 자산 수익율을 유지하는 것도 중요하다고 봅니다.|배당도 하고 성장도 하는 기업으로는 Broadcom 이 최고예요 ~AVGO|이 두분의 투샷.... 놀랍습니다. 제 최애 유튜버 두 분이 만나다니요.|월 500씩받으려면 단순배당 안정적으로는 12억이지만

S&p500 성장하는 연12%정도니까 5억만 있어도 월 500됩니다.|소수몽키님은 끝임없이 분신술 중이시네요 ㅋㅋㅋ 멋있어요👍🏻|저도 부동산과 주식으로 패시브인컴 만들고 있는데 목표금액은 월 300만으로 잡고 열심히 공부하며 만들어 가는중입니다.
소수몽키님 채널도 자주봅니다^^|미국은 애플... 한국은 삼전이 시가총액 1위 여기에 묻어두고 따박따박 타먹으면 됨|소몽님이다~♡♡♡|꺅 소몽님!!!!!!!🙌🙌|제가 투자하고 있는 배당주 입니다
ABBV, SCHD, T, JPM, LMT, O, MO, STAG, MPW, CCI, SPYD, TXN|이제 12억 모으는 방법만 알면 ㅋㅋ|작은 돈부터 조금씩 늘려서 12억을 모으면 미션 클리어가 되겠군요!|공짜는 절대 없어요....|소몽님 여기서보니 진짜 반갑네요~! 소수몽키님 덕분에 미국주식에 발들인 1인 ㅋㅋㅋ|감사합니다 신사임당님!|아하! 감사합니다|우와 부럽습니다 저두 월500배당 나왔으면 좋겠어요 저두 노력해볼거얌|제가좋아하는 두분이네요ㅠ작년 이맘때보기시작해서 자산  계속불려나가는중입니다 너무감사한분들|10억이 어디있나요 이딴소리 하고있나왜, 계속 모아가는거지|12억은 대체 어떻게 버나요ㅋㅋㅋㅋㅋ|조만간 신사임당님 주식 하시겠네요 ㅎㅎ
좋은 영상 감사합니다^_^|소몽님💜💜|월1000씩부동산이 오르는중 ㅎㅎ|하나금융지주 신한지주 로 20프로 수익 먹고 있는 개인투자자입니다. 영상 촬영 시점을 정확히는 모르겠지만, 지금에서야 배당주 들어오시면.. 상투 잡기 딱 좋아 보입니다,, 엑슨모빌도 겁나 올랐던데|오랜만에 신사임당 왔어요
소몽님 초대해주셨네요
주 피디님 건강해 보여서
좋네요
스벅,맥도 물건너갔네용~~
어쩌지요?|애플 추천 
주가도 오르고 배당금도 굿"
