name,title,date,video_url,view_num,likes_num,unlikes_num,comments
가난할 때는 몰랐던 것들,가난할 때는 몰랐던 것들,2021. 4. 11.,http://www.youtube.com/watch?v=55osn87i7TQ,"조회수 206,717회","좋아요 4,572개",싫어요 98개,"사실 나 자신은 바뀐게 없는데 내 수입에 주변 시선이 바뀐게 참 좋으면서도 씁쓸한 현실입니다.|이 영상 보고 숨고 시작하고  새벽에 고객님 PC고치고 있습니다. 
난생 처음으로 새로운 도전입니다.
저의 지식으로 회사 안다니고 돈 벌어 보겠습니다.|여유가 있어야 생각을 할 수 있게 된다.
돈에 쫓긴다는 느낌이 안든다,, 진짜 공감합니다,,|숨고 악평 많은 어플로 유명합니다.
판매자 입장에서 견적서 낼때마다 수수료 떼가는  캐쉬 정책때문에 원성이 자자합니다. 어떻게 그와중에 성공하셨는지 궁금하네요|이건 마치 비법대 사법시험 초짜 준비생이 민법 과외하면서 사법시험 합격하는격임 ㅋㅋㅋㅋ 아무튼 뜻밖의 재능을 발견하신게 핵심이지 않을까 싶어요 저도 고민은 적당히 하고 뭐든지 시작해봐야겠어요 핵심은 진짜 일단 뭐든지 부딪혀보자가 아닌가 싶네요|1. 완벽해지기 전에 일단 시작하라!

2. 최고가 되려고 노력하라!

3.마음의 여유를 가지고 발전할 수 있는 방법을  생각하라! 

시작하고 시도하고 발전시키며 자신만의 방식을 찾으신 것 같아요. 좋은 이야기 전해주셔서 감사합니다! 새로운 도전도 응원합니다! 😊|게스트분 머리가 좀 비상하신거 같아요. 숨고에서 자기 분야에서 일등이 되기 위해서 하신 노력들이나, 그룹과외, 기프티콘 선물,  프로그램 결과물을 다른데 또 응용해서 돈을 버시기도 하고,,, 실행력이 엄청 좋으시고, 노력도 많이 하셔서, 1등이 될 수 밖에 없었나봐요.  신사임당님 풀시청하고 갑니다. 오늘도 좋은 영상, 좋은 정보 감사합니다.|공감합니다 잘나가는 사람들보면 그사람의 노력보다  그사람의 운이나 원래가진 영향력이 있을거다 라고 정신승리를 하죠  정말 그사람의 노력을 보는 사람이야 말로 성공할수 있는 자격을 가진사람 입니다~|이분 인터뷰 정말 좋았어요. 말을 포장하는 기술 없이 성공으로 가는 과정 중간 중간의 느낌과 욕망(? ㅎㅎ 긍정적 욕구!!)에 대해 아주 순박하게 잘 말씀해주셔서 집중해서 봤습니다. 고맙습니다.|15:30 저만 한군데 때려맞은듯 느낀게 아니였네요. ""여유가 없으면 자꾸 자꾸 쫓긴다"" 인상깊은 구절이였습니다.|부업으로 300만원까지는 가능한데, 어떻게 1000만원을 만들수 있을지 신사임당님의 ""사기꾼이라 해도 할 말 없다는..."" 영상을 보고 답을 찾았습니다. 독하게 부자되어 언젠가 저도 출연신청해보고 싶네요^^|평소 출연자분들과 다른 경험을 이야기해주셔서 뭔가 색다르게 들리네요 저도 실천할 용기 얻고 갑니다.|돈 벌 방법은 얼마든지 있네요 아직 못찾았을 뿐..|힘든 상황 속에서 고민하고 해결할 방법을 찾아내는 것이
돈 버는 비밀이구나 싶었어요. ^-^ 잘 들었습니다.|조급할때 실수가 많고 중요한 걸 놓치기도 했는데 반성하고 갑니다
차분하게 하루하루를 시작, 돌아보겠습니다
좋은 영상 감사합니다^_^|최고 아니면 최초가 되어야 되는거지|와~~ 그동안 돈 버는 방법으로 대부분 스마트스토어나 부동산. 주식 등 너무 커서 엄두가 안 나는 것들이었는데~ 숨고는 충분히 시도 해 볼만 하네요~ 좋은 🍯꿀팁 감사합니다~💕👍|배짱이 대단하심ㅋㅋ|돈 버는 방법은 무궁무진하네요 정말,, 좋은 영상 감사합니다|신사임당님 만나서 정말 반가웠습니다. ^-^ 정말 재밌었어요!|어쩜 요즘은 이렇게 다들 똑똑하신지...참 대단하시네요|틈새 시장을 찾아서 1등이 되어라. 1등이 될 능력을 키우든가 잘 찾아라.|완벽하지않았음에도 일단 시작해본다는 그 생각이 아침에 와닿았습니다^^ 오늘도 용기내어 하루를 시작합니다|대단하십니다. 신사임당님도 이번에 나오신분도 말하는것중에 공통점이 제대로 준비해서 하는게 아니라 지금 바로 시작하고 하면서 수정해나간다는 점이네요. 저도 생각 그만두고!!실행하겠습니다.|의뢰한사람 빡치겠다... 내돈내고 만들어서 남들은 더 싸게 파네...|준비하고 시작하는게 아니라 시작하면 준비가 된다는 말씀은 이분도 똑같이 하시네요 영상 잘봤습니다!|숨고를 통해서 성공한 케이스인가요? 이번 게스트분은 숨고를 통해서 수익을 많이 창출해서 나오신 건가요?  요새는 정말 온라인을 통해서, 기존과 다르게 수익을 많이 창출할 수 있네요. 진짜 신기한 세상입니다.|생각할 시간이 있어야 한다는 것에 공감합니다 대단하십니다 앞으로 더욱 승승장구 하실 듯 합니다 노하우 알려주셔서 감사합니다|여유가 있어야한다. 그만큼 멘탈과 마음가짐이 중요하다는 이야기네요. 똑같은 상황에 처해있어도 누군가는 좌절만 하고 있지만, 누군가는 돌파구를 찾는거죠.|교수님  잘  만나셨네요|실무에서 일하는 개발자로써, 주변에 보면 가르치는걸 잘하는 개발자분이 있는대 그런 타입이신듯.|형님도 영상 알차게 올여주셨어 감사합니다 행복하루 보내세요~|6등^^|숨고 가니깐 메인에 인터뷰 영상올라왔네요|연구실 연초 돈안나오는거 극 공감 ㅠㅠ|늘 좋은 영상으로 인사이트 많이 얻어 가고 있어 감사합니다|다른 영상들보다도 좋은것 같아요.|일단은 하고보라 ㅜㅠ|항상 힘이 되는 사람들을 찾아서 영상 올려주셔서 감사합니다!|영상 유익해요!! 잘보고갑니다|지금은 숨고 최소 충전액이 37000원이네요 ㅜㅜ 예전에는 2000원만 내도 되었나봐요 문턱이 높아졌네요|우와 멋진 젊은이네요!! 응원합니다!!|좋은 정보 감사합니다^^|감사합니다|ㅠㅠ|잘 되는 분들의 공통점이 급한 상황에서도 여유를 잃지 않고, 추가로 여유를 만들기 위한 노력을 끊임없이 한다는 점인 것 같습니다😊|좋네요~~ 청년분이 잘 되셨다니♡♡|실천할 용기를 얻고 갑니다. 감사합니다😊|맞아요 창의성은 심심할때 나오는거에요|잘봤습니다|숨고 너무 좋아요 ㅎㅎㅎ|유익한 내용 나눠주셔서 감사합니다|감사합니다~ 고맙습니다~^^|감사합니다~♡♡|숨고로 사업을 시작해보려고 하는 1인 입니다. 영상에서 많은 도움을 받았습니다. 출연해주신 분과 신사임당님에게 감사드립니다^^|공감합니다❤^^감사해요!|1등이 중요하네!!!~~^^|월 3000순이익 벌때도 있었는데 현재는 300범 잘나갈때는 영원할줄 아는데 현실은 그렇지 않다  중요한건 꾸준한거지|순고? 순규? 승규? 숨고였네요;;|본인이 숙련자가 아닌 상태에서 작업 의뢰를 받고 공부하면서 마감일을 맞춘다는게 보통일은 아닌데 그것이 가능할 거라는 확신이 어디서 왔는지 어떻게 행동으로 옮길수 있었는지 궁금하네요|와.. 난 영어 일어 가르치는데.. 리뷰랑 횟수를 통해서 랭킹을 올리는 작전을 써야겠다..|수많은 노력한 사람중에 운과 실력이 따랐기에 이 자리에 있을 수 있는거겠지. 그렇지만 아무것도 하지않으면 바뀌는 것은 없음. 잘 될거란 보장은 없지만, 그 시간에 아무것도 안하는 것보다야 뭐라도 하는게 낫다.|15:50 넘 와닿네요.|숨은고수에서 진정한 고수가 되셨네요.|참 별거 아닌것처럼 얘기하고 있지만 정말 똑똑하고 부지런하네요|고생하셨네요. 저도 고생을 많이해서 그런지 보면서 눈시울이 촉촉해집니다. 앞으로 더욱 번창하시길 바라고 이제는 조금 여유로움도 누리시면서 사시면 좋겠네요^^ 충분히 그럴 자격이 되시니깐요ㅎㅎ|숨고|저도 숨고하고잇는데 수수료때문에 따로 돈을받고있었는데. . . 랭킹이란게 있는게 첨알았네요|모닝빵을 두개씩만 드셨다니 놀랍습니다.|궁금한게요. 그런아이디어 이런게 다있는데 그걸 실제로 이뤄내는 그 스타트 팀구성이 어떻게시작되는지 궁금해요.|멋진 인터뷰 잘 봤어요|완벽하지않든 뭘 하든 결국 자기가 가지고 있는 분야의 것을 판다는데 난 그게 없구나... 그거 없는 사람 없다고 나에대한 장단점을 객관적으로 봐도 숨고 카테고리에 있는 모든 영역을 봐도 내가 내 새울 장점이 하나 없다 결국 가진 자가 실행을 하든 뭘 하든 하는거네...|1등|어떠한 포인트를 잡고 큰 틀을 설계해나가며 마치 게임하듯이 라고 굉장히 덤덤하게 얘기했지만 엄청 중요한 얘기네요 ^^|여유가 있어야 생각을 할 수 있다는 말씀이 마음에 와 닿아요 :) 살기 바빠서 쫒기다 보면 시간은 후루룩 가버리고 난 늙어있고 ㅠ 우리 모두 힘내요!|프로그래밍 비 전공자가 스스로 공부하시면서 남을 가르치셨다? 이미 타고난 두뇌 소유자 이신겁니다.|🎈🎈🎈🎈🎈🎈🎈
잘 볼께요! 그런데 어떻게 조회수1000회를 몰고 업로드가 되나요?...
참신기하네요!
🎈🎈🎈🎈🎈🎈🎈|어라 나도 아주대졸업인데 후배군요. 자랑스럽습니다|여유가 있어가있어야한다 여유 말 공감됩니다 여유가 있어야되고  돈에  쪼낀다는 생각하면 할수가없다 쪼긴다다느낌이안든다 공감합니다 바둑판 비유도좋아네요 배울게 많으네요|ㅎㅎ 평범한 문과출신으로보면
프로그래밍을 그래도조금이라도잘하시는거자체가 평범 이상으로 봅니다 ㅎㅎㅎ
저도그런기술이있었으면좋겠어요ㅠ"
2022년 돈버는 규칙이 바뀐다 (김상균 교수),2022년 돈버는 규칙이 바뀐다 (김상균 교수),2021. 4. 10.,http://www.youtube.com/watch?v=55osn87i7TQ,"조회수 176,825회","좋아요 4,123개",싫어요 72개,"대충 멀티게임을 일상생활로확장시킨다는거네|아직 크게 공감이 가진 않지만 , 아이가 로블록스에 빠져서 즐거워 하는거 보니...미리 메타버스 관련주 사둬야 겠군요...|아직 새세상에 적응도 못했는데 다른세상이 또 오네요.|최고의 인터뷰입니다. 한국 기자들이 신사임당님 1/10 만 따라와도 한국 언론이 천지개벽될텐데 ..! ^^ 암튼 알차고 흥미진진한 인터뷰  잘 들었습니다!|오호 제가 영상에서 다뤘던 엔비디아의 젠슨황이 했던 말이 떠오르네요! ""앞으로 20년은 메타버스다!""|싸이월드 기존 자료는 그대로 살아있나여? ㅜㅜ|세상이 완전히 바뀌고 있습니다|메타버스 어디 다니는 버스인가에 빵터졌어요 ㅋㅋㅋ|책 잘읽었습니다. 메타버스의 대중화에 기여해주셔서 감사합니다.|하... 유튜브보면서 이렇게 이해하지 못할듯 할듯 못하는 답답한 기분은 처음이다 수업듣는거같다|nfc 투자. 
새로운 이익 공유 분배 방식|새로운 용어들과 새로운 세상을 잠깐 엿본 느낌 딴세상이 오나요 ?
강의 고맙습니다|며느리들도 명절때 메타버스타고 메타버스공간으로~~ㅎㅎㅎ|아ㆍㆍ오늘 영상은 싸이월드만 알아들을수 있고ㆍㆍ넘 어렵네요 ㅜㅜ
늘 좋은 영상 너무 감사드려요 ^^|아바타로 살아가는 디지털 공간->메타버스|정말 공부에 끝은 없는 것 같습니다! 잘 배우고 갑니다😊|로블록스 재미없다고했던 사람은 있어도 한번만 해본 사람은 없지 ㅋㅋㅋㅋㅋ|미래의 게임을 보면, 리니지가 얼마나 대단하게 만들어진 생태계 게임이었는지를 알수가 있음.
단, 어느순간부터 너무 중앙화로 개인들이 돈을 못벌게 회사에서 직접파는 아이템들이
너무 난무해졌지만.....|메타버스 너무 궁금했는데 감사합니다|너무 어려운 내용이다 ㅠㅠ 모르겠어|좋은영상 감사합니다!|인간의 능력은 어디까지 갈것인가??|그래서 저는 메타버스 관련 해외주식 ""유니티소프트웨어""장기투자중입니다 ^^ ㅎㅎ|와 김상균 교수님을 신사임당님 채널에서 뵙다니 반갑습니다!! 덕분에 메타버스 개념 잘 배웠습니다 ㅎㅎ|많은 영감을 받고 갑니다. 감사합니다.|자 이제 탑승할 타이밍입니다~!! ㅎㅎ|미드-업로드 추천합니다.|우와 삼분 전은 못참지|와 진짜 메모하면서 열심히 들었어요!!! 감사합니다 ^^|감사합니다.
생소한 분야에 공부를 하였습니다.^^|디센트럴랜드 마나코인 매수 시그널이네요|지속가능이 되길...|주 모인 ,vr기업 모션슈트 최곱니다|우리 애들이 들어가면 안 나오겠네요.^^
헌데 나도 들어가고 싶어😉|딸 로블록스 시작했습니다^^|싸이월드 너무 기다려집니다   ㅎㅎ|교수님 책도 재밌게 봤습니다!|책 1분전에 샀는데 동영상이 올라왔네유...|김상균 교수님 덕분에 메타버스 개념을 확실히 잡게 됐었는데 여기서 이렇게 뵈니 더 반갑네요^^|두분이너무닮았어요~~|좋은정보 감사합니다.|게임을 유해한 것으로 인식하는 우리나라에서는 메타버스 플랫폼도 뒤처질듯..|미래의 고차원적인 글로벌한RPG 게임이라고하면 될까요?|흥해라 신사임당! 메타버스에서도|어스2|많이 배웠어요|두분 닮은것 같지 않아요??|최근에 메타버스 열풍을 타고 재출간된 sf소설 <스노 크래시> 추천합니다. 재미있어요. 소개해 주세요~~~|진짜 과거에 아프리카TV나 Twitch, Youtube가 대세가 될 줄은 꿈에도 몰랐는데
분명 메타버스는 대세를 넘어서서 우리 일상에 녹아들 것이라고 본다.
스티븐 스필버그가 제작한 소설 원작 영화 '레디 플레이어 원'만 보더라도
우리는 현실과 사이버 공간의 경계를 허문다는 것에 반감만 있는 것은 아니기 때문이다.|ㅎㅎ|초등학생도 줌 수업하다가 소회의실에 따로 모여 회의하고 그래요.|외계어 듣는 느낌?|온라인으로 뭐든지 가능한 세상..! 오늘 내용 너무 흥미롭네요!!!|유희열|교수님 Vr를 한번 사용해보세요. 젊은 사람도 반시간만 사용하면 눈물이 나고 머리가 아파요. 이 문제는 해결 안될거 같은데요. 사람건강에 너무 심하게 나쁜거 같애요. 특별히 눈과 뇌....|초반에 3가지 말씀하신 플랫폼이 무엇인지 아시는분~~~|신사임당님 인터뷰할때 너무 즐거워보이세요 ㅎㅎ|한걸음 먼저가는 신사임당 채널 인터뷰 .. 역시 입니다. ^ ^|Face book ceo가 나와서 메타버스에 대해 설명을할때 이해못했어요 
그러나 믿고 주식을 샀어요   앞으로의 세상이 놀랍고 한편으론 두려워요|메타버스 읽고 나와는 별개라 생각했는데  유튜브를 보면서는 계획이 생겼네요.  감사합니다.|얍|디센트럴랜드|게임회사가 막혀있는게 아니고 게임회사가 가장 매타버스를 잘 구현활 수 있는 곳입니다..
이분 잘 모르시네요
게임회사가 막혀있는곳이면 도데체 어디가 매타버스를 구현할 수 있는 회사가 있을까요?
직접 말씀하신 로블록스도 게임회사입니다 ㅎ|애들은 밖에서 땀흘림서 뛰놀고 살부대끼며 소통하고 해야하는데 코로나때메 밖에서 친구들과 못놀게하니 겜만 하면서 다른걸 하려하지않네요 살만찌고 맨날 속안좋다고 움직이지않고 먹고 앉아서 공부하거나 겜만하니 ............육체적 정신적 건강이 걱정됩니다 ㅜㅜ 뭔가 아이들을 움직일수 있게하는 게임 좀 유행 되었으면ㅋ ㅋㅋㅋㅋ이놈의 코로나 언제 없어지나요 ㅜㅜㅜㅜㅜㅜㅜㅜㅜㅜㅜㅜ|아 이런 미래지향적 영상은 언제나 빅웰컴입니다! 레디플레이어원 보던 느낌으로 들었습니다!|요즘 떠오르는 개념을 너무 알기쉽고 재밌게 알려주셔서 정말 유용합니다|결국 가상현실(게임)과 메타버스의 차이는 소유권이 사측에 있냐 유저측에 있냐의 차이인거네, 사용자가 가상현실에서 경제활동을 할수 있게 되면서 단순한 가상현실이 아닌 제2의 현실로 진화하게 된거군|아 이런 이런 정보를... 알려주시다니...
....여러분 메타버스는 뜹니다|네이버 언제 오르냐 주주는 속이 탄다~~|16:40 여기서 말한 회사가 뭔가요?|여러분 earth 2 가상부동산은 폰지사기 입니다|지금 현실화 됐어요      일부사람들이 미친듯이 달리고 있습니다|알체라|가상부동산에 관해서 설명하는 저에게
유튜버님 메타버스 영상 저에게 너무 도움이 많이 되었습니다.
김상균 교수님의 설명도 너무 좋았습니다. 
도움주시는 영상을 올려주셔서 감사합니다. ^^|커뮤니티 이상의   유용한 어플리케이션이나 컨텐츠는 만나기 어려울것 같네요|내가 페이스북에 투자중인 이유중 하나군요.|나는 쥬피터에서 어디에 갇혀서못나오고잇응|옛날에 어렸을때 햇던게임중에 팝플인가? 피플인가 하는 게임이있엇는데 아시는분....... 그거랑 되게 비슷하게들리네요ㅎㅎㅎ추억이여|5등|인류가 멸망하기 위한 첫 시작이 된셈이네요. 거짓과 위선으로 가득찬 세상. 기어이 그 세계를 향해. .결국  인간이란 고등 동물들이 스스로가 만드는  인류 멸망을 피할수가 없는거군요"
(광고)동학 개미에게 전하는 투자회사 대표의 진심 어린 조언 (Chris 두나무투자일임 대표),(광고)동학 개미에게 전하는 투자회사 대표의 진심 어린 조언 (Chris 두나무투자일임 대표),2021. 4. 9.,http://www.youtube.com/watch?v=55osn87i7TQ,"조회수 48,104회",좋아요 880개,싫어요 57개,"그냥 영상이 통째로 광고네|이번 영상은 제목에 낚인 느낌...|실망이네요 완전광고네|와우 두나무~~~~ 요즘 나스닥 상장관련 난리죠^^|2등!|개미개미 핵개미에요~ 사임당님 늘잘보고 도움받아가요~|ㅋㅋ 저런|개미는 오늘도 공부합니당,, 후후|1등|원칙을 지켜나가는게 제일 중요할 것 같습니다.!|어려워도 화이팅해보겠습니다|신사임당님이 주식종목이었다면 젤먼저 돈박았을거임 ㅇㅈ?|요즘 이런저런 투자에 정말 관심이 많은 것 같습니다~! 정말 투자는 여유자금으로 해야되는거 같아요~~ 

저도 돈이 정말 없을 때 투자를 해서라도 이 인생을 탈출하자 생각해보기도 했는데 중요한 것은 내가 안정적이지 않을 때 하는 투자는 투자가 아니라 도박이라는 생각이 듭니다

신사임당님 채널을 안봤다면 저고 영끌을 하고 지금쯤 존버를 외치고 있을지 모르겠습니다

다행이 지금은 신사임당님 채널을 보고 월 5000만원 매출 달성하였고 지금은 꿈이 내 회사를 키워서 내 회사에 투자를 하자는 마인드로 나아가고 있습니다

물론 여기서 더 안정이 되면 여유자금으로 주식을 통해 더 다양한 사업에 참여 한다는 느낌으로 투자를 해보고도 싶네요~!

지금은 투자보단 투지를 가지겠습니다^^|감사합니다|이건뭐대놓고광고만하네|광고네...|진짜 신사임당임 때문에 투자에 대한 마인드가 달라졌어요 콘텐츠 감사합니당 ㅎㅎ|잘봤습니다 감사합니다! 제 채널에도 놀러와 주세요~ 영혼을 갈아 넣은 추천주 알려드려요!!|응 안해~|국민연금 방식 인것 같음. 국민연금 운영하는 분들 자부심과 명예라고 할까, 거기에 수익률 끝내주고|요즘 제일 핫한회사 대표님이 나오셨네"
