name,title,date,video_url,view_num,likes_num,unlikes_num,comments
서른 넘으면 먹어야 되는 3가지 (고약사 @약사가 들려주는 약 이야기 ),서른 넘으면 먹어야 되는 3가지 (고약사 @약사가 들려주는 약 이야기 ),2021. 6. 14.,http://www.youtube.com/watch?v=55osn87i7TQ,"조회수 98,098회","좋아요 2,007개",싫어요 66개,"할인코드 : SSIDKYS / 전품목 20% 할인 (계정 당 1회 사용가능) / 6월 14일 ~ 7월 13일|고약사님 오래된 찐팬 구독자에요💕💕 여기 나오셔서 완전 놀랐어요!!!!! 갓독자라면 꼭 챙기는 오마비😉|1.탄수화물 줄이자(밥양 줄이기)
2.단백질 섭취하자 
3.오메가3섭취(중성지방 제거에 도움) 
4.믹스커피 줄여라(끊는게 좋다) 
5.스트레스를 이겨낼수있는 취미를 가져라
(시간을 할애해서 해야함/시간 날 때 해야지x ex.운동,명상)
6.오마비-오메가3(중성지방 제거),마그네슘(피로개선,스트레스 로인한 우울감 수면장애 줄여줌),비타민B 섭취하기|탄수화물을줄이자 
단백질을섭취하자
중성지방을제거하기위해 오메가3먹자
스트레스받지말자 취미를 가지자
마그네슘을먹자
비타민B군을먹자
오마B=오메가3+마그네슘+비타민B 처음알았네요 30대를 바라보는 저에게 유용한 정보 감사합니다 (꾸벅)|와웅 신사임당님 채널은 경제 외에도 이런 유용한 정보를 알려주셔서 유익하고 감사합니다 ㅎㅎㅎ|ㅋㅋㅋㅋ신사임당님 진짜 거의 공중파ㅋㅋㅋㅋ|신사임당님 실버타운 관계자분도 인터뷰해주세요 노후 대비해야하지 않겠나요 ㅋ|약을 끊으려면 약을 먹어야 하는 ㅠ 원인을 잡지못하고 증상을 치료한다는 고약사님에게 진짜 진정성이 느껴집니다 ㅠ 주변 약사님들에게물어봐도 안알려주는꿀팁! 감사합니다! ^^|어제 본 책에서도 비타민B를 꼭 섭취하라고 하던데, 고약사 님도 좋다고하시니 한 번 먹어봐야겠어요. 감사합니다!|헐 고약사님을 여기서 본다닠ㅋㅋㅋㅋㅋㅋㅋㅋ|고약사님 나오셔서 저도 모르게 어!!하고 입밖으로 소리냈어요. 여기서 뵈서 좀 놀랐지만 그만큼 반갑네용🤗|어 고약사님이시다
왠지 반가운 이 마음 ㅋㅋㅋ🥰|1. 탄수화물 줄이기... 부터 실패 ㅠ|아니 이두분을 한자리에서 보다니~~!!!!|어머~~ 고약사님을 여기서  뵙다니.. 너무 반갑습니다~^^|고약사님 구독자인데, 여기 나오셔서 깜놀입니다. ㅋㅋ
알려주시는 꿀정보로 비타민 셋팅해서 가족들 모두 잘 먹고 있습니다.
감사합니다. ^^|방금 마쉬멜로 먹었는데 ㅜㅜ … 괜히먹었어..|와 고약사님 나오시네 제 생명의 은인ㅜㅜ|세상에 신사임당님 채널에 고약사님이 나오시다니..!!|고약사님이 왜 여기서나와~~~~~~|고약사님 화이팅 먼저 외치고 시작하겠슴다!|화이팅하고 시작하실줄 알았네요ㅋㅋ|와 약들약이 여기까지??!!|고약사님과 콜라보. 좋은 정보 감사합니다~~^^|고약사님.ㅋㄱㅋㄱ화이팅외치고 시작합니다♡♡|제가 늘 챙겨보는 조합 이네요~
신.약 조합ㅋㅋㅋㅋ|마그네슘 오메가... 비타민?|반가운 고약사님~~~|약이 약을 부르는거 진짜 맞는거 같아요|앗...고약사님....와우~~~|와 고약사님이다~~~~|앗 고약사님!!!|덕분에 구독하고 영상 참고하려 합니다 감사합니다~|신사임당 채널에서 뵙다니 너무 반갑네요. 역시 유용한 컨텐츠네요^^|오~~ 넘나 유익한 영상이었습니다.
오마비  아이허브
감사합니다♡.♡|와...고약사님 ㅠㅠㅠㅠ 대박이네여~~ 연예인 보는 너낌~~갓독자가 응원 할께요!!^^|여러 분야 전문가들 초대해 주셔서 감사합니다! 신사임당 채널 흥해랏!|오메가3 먹는 이유를 딱히 잘 몰랐었는데 필수로 챙겨야겠네요|오마비~!|고약사 님, 채널 잘 보고 있습니다👍🏼|유일하게 먹는 영양제 3가지와 똑같아서 뿌듯하네요 ㅋㅋ|30부터 밥을 더 많이 먹엇는데 ㅌㅋㅋㅋㅋㅋ|유용한 내용 감사합니다|고약사님 반갑습니다.|화이팅 한번 외치고 가겠습니다! 화이팅!|고약사님 너무반갑습니다
오마비 늘 지키고 있어요🥰!!!|운동해야지 ~|오. 마침 3가지.다 먹고있어 다행이네요 ㅎ 비타민 b입병도 덜나고 마그네슘 잠이 잘 와서 좋아요.|고약사님 감사요~~
한동안 안챙겨 먹었는데 오마비 ~!
다시 먹어야 겠어요~~^^|고약사님이 여기 나와서 깜짝 놀랐어요~~^^|고약사님 신사임당 찐구독자인데..
두분의 조합 완전 굿 입니다~~^^|약들약 좋은 정보 꾸준히 경청하고 있는데 여기 나오셨네요^^|와....우리 갓약사님♥ 임당님 채널에두 나오시고!! 맘씨좋으신 우리약사님 항상 감사해요!!♥♥♥♥♥♥|협심증이요?ㅜ.ㅜ  건강 잘챙기셔야해요~~|고약사님을 여기서 뵙네요 ㅋㅋㅋㅋ 항상 생각하는거지만 안경 벗으면 훨씬 잘생겨지실것같아요!! ㅎㅎ 그나저나 어쩜 말씀하시는 내내 웃는상이세요~^^|벌써부터 먹고있쥬~~~오마비^^* 고약사님~~~넘 좋아요~|탄수화물에서 당황잼,,,, ㅜㅜ|와. 고약사님 여기서 보니까 너무 신기해요!!|오마비!!!! 30대 초반인데 마그네슘 추가해야겟네요!!!|당... 매일 커피대신 첵스초코랑 코코볼만 먹는데;;|오메가 3는 꼭 먹어야하는듯|고약사님 여기서 뵙네요 ~ 반갑습니다|헐 고약사님ㄷㄷㄷ  ㅎㅎㅎㅎㅎ
잘못들왔나 잠시확인했네영ㅋㅋ
두채널다 애청자인대 너무 반갑네요오~~~~|ㅋㅋㅋㅋㅋㅋ 고약사님이시다|고약사님 채널보다보면 먹는 영양제 갯수가 안늘 수가 없지요. ^^|우왕 ㅎㅎ 고약사님이 😀|고약사님의 오마비 항상 잘 챙겨 먹고 있습니다.|대박 콜라보|오우야|잘봤습니다 👍|고약사님반가워용♡♡|아니 ㅋㅋ 고약사님 ???|고약사님 잼있어용^^|고약사님 약들약!!!!!!!!! 반가워요~~~|과자먹음서 보고있는...|와우 약사님 영상들 보는데 신사임당님 채널에서 뵈니 반갑네요~!|04:00 - 20년전에도 관점이 학교에서 배울때도 탄수화물도 많이 먹지 마라 배웠는데...탄수화물도 많이 먹게되면 칼로리 잉여로 지방으로 전환된다고 배우는데...|어랏 고약사님을 여기서 뵙다니|X리X 고약사님 아니십니까? ㅋㅋ|오메가3. 마그네슘. 비타민B"
"저는 5,000만원 있다면 ○○ 시작 합니다 (서민갑부 안정일)","저는 5,000만원 있다면 ○○ 시작 합니다 (서민갑부 안정일)",2021. 6. 14.,http://www.youtube.com/watch?v=55osn87i7TQ,"조회수 168,851회","좋아요 3,548개",싫어요 88개,"안녕하세요 ^.^
설마 이게 될까? 하며 시작했다가 결국 되버린 설맙니다. ㅎㅎ
 
제가 신사임당님 채널에 출연하다니… 
너무 재밌고, 흥미로운 경험이었습니다. ㅎㅎ
 
신사임당님을 예전에 뵌 적이 있었는데,
유명해지신 이후에도 여전히 예전 소탈함이 그대로 남아 계시더라구요.
역시 성공 하시는 분은 뭐가 달라고 다르다 싶어요. ^.^
 
저는 조그만 카페를 하나 운영하고 있거든요.
네이버에서 홈336을 검색 하시면, 우리끼리 조용히 모여서 놀고 있는 카페를 발견하실 겁니다. ㅎㅎ
 
즐겁고, 재밌는 자리를 마련해 주신, 신사임당님께 감사를 드립니다. ^.^

홈 336카페 : https://cafe.naver.com/home336
홈 336옥션 : http://auction.home336.com/|저도  건물주를  꿈꾸며  한달전부터
경매를  본격적으로  배우고  있네요~
부동산 공부는  필수로  해야하는것  같아요^^
유익한 내용  감사합니다^~~^|서울이 투기과열 지역이라 대출이 전혀 안되는데 1억5천짜리 빌라를 레버리지로 1~ 2천만원에 살 수 있다는 것은 지금 현실과는 맞지 않는 말 아닌가요?|지금 재생속도 일반이 실화입니까?|제가 이분 서민갑부에서 나오시는거보고 부동산경매 시작하게됬었습니다 저분은 저를 모르겠지만 저에게는 빛과 소금같은 분이져 여기서 볼줄이야 잘되셔서 너무 좋아요 ㅎㅎ|작년부터 재테크 공부시작하고, 실행 중인데 신사임당님 채널에서 정말 많이 배웁니다 :)|재생속도 확인해봄|말빠르기 진짜 레전드입니다 ㄷㄷ
느린 것보다 빠르게 듣는게 좋네요 ㅎㅎ|앗..스승님께서 신사임당님채널에!! 무지무지 반갑습니다..|우와^^ 경매를 왜 배워야 하는지 찐으로 알려주시는 진정한 고수이십니다^^♡♡|제가 좋아하는 두분을 한 화면에서 보다니.. 넘 좋아요. 
신사임당님 어떤 분을 인터뷰하던지 배려돋는 진행 언제나 정말 멋집니다. 
설마님 한국인이 좋아하는 말빠르기 ^^ 정말 막힘이 없으세요. 
솔직하고 진솔한 방송 잘 봤습니다.|좋은말씀감사합니다!!
이해가 쏙쏙 되네요^^
근데너무짧아서 아쉽습니다ㅜㅠ
2탄기대해봅니다!!|설마님이시네. 역시 알맹이만 쏙쏙 알려주시네요. 잘보고 배우고 갑니다|내자산을 지키기 위해서~★|와 설마선생님 여기서 뵈니 너무 반갑습니다~^^ 방송감사합니다|현재 1년이내면 양도세 엄청 큰데 할만한가요?|ㅋㅋㅋㅋ설마쌤!!!|경매를 배워야하는 이유!  영상 재밌게 봤습니다 ㅎㅎㅎ👍🏻👍🏻|임차인들도 경매를 배워야하는이유..
정확히 이야기해주시네요. 
알아야 내 재산을 지킨다!! 
좋은 영상 감사합니다. 
좋아요 구독 했어요♡|아ㅛㅣ 우리아빠랑 똑같이생겨서 깜짝놀랬네.....|설마님! 여전합니다. 좋은 말씀 잘 들었습니다.|비둘기 많은 동네 성북동... 문학적인 표현이시네요~ 한수배우고 갑니다^^|한국인이 좋아하는 속도로 꿀같은 정보 주셔서 감사합니다|내가 재생속도를 1.5배로 해놨나 싶었네요 ㅋㅋㅋ 한국인이 좋아하는 말빠르기에 유익한 내용까지!
빌라는 안된다는 말만 듣다가 생각을 다시 해보게 됐습니다 감사합니다!|우와~ 안정일이다
경매에서 유명한 분이신데...
이제 이 분까지 섭외를~~~|언규행님 좋은영상 감사합니다~|설마님이 나오셨네요~^^  자가이든, 전세살든  부동산공부는 필수인거 같아요  꾸준히~~|우와~ 사부님~^^|설마쌤이네 ㅋㅋㅋㅋㅋ 누군가했네요|부동산 경매는 배워두면 여러모로 참 쓸모가 많습니다. 임대인 뿐만 아니라 세입자도 알고 있으면 돈 잃을 상황을 줄일 수 있죠 ㅎㅎ|부자들만 아는 그들만의 언어|앗 설마님 바로 달려왔습니다~!!! 오햇🤗|와~~~~멋진 두 분의 콜라보 토크~! 2부는 곧 올라올까요? 너무 유익하고 값진 말씀 감사드립니다~!|경매 입니까? 경매 배우고 있어요.|와 기다렸습니다:-)|감사합니다 임당님!|설마님이시네요 저는 홈336을 알게 되어서 인생폈습니다 ㅎㅎㅎ 
많은 분들이 부동산에 관심 있으신데 경매를 배우면 부동산의 ABC를 배우게 됩니다. 
물건 분석하는법, 임장하는 법, 가격 잡는법 등등 
너무 유익한 홈336!!|와 설마님 방갑습니다~^^|존경하는 설마샘 ♡|설마님이네!!|설마님이. 신사임당에 ㅎㅎ 반갑네요|우와…설마님!!!!!!|감사합니다|마음 따뜻하고 착한 건물주 설마님 2탄, 3탄 계속 보고 싶네요~^^|설마님께 강의 들었는데  계속 이어서 못 했어요.전 17년에 시작했었는데  끈기를 가지고 했더라면 수익을 좀 봤을 것 같네요.|저서민빌라살아요~|잘듣고갑니다^^|항상 좋은 영상 감사합니다. 경매는 부동산을 가장 싸게 살 수 있는 방법인 것 같습니다. 다주택자, 법인은 각종규제로 인해서 진짜 무주택자에게 좋은 기회인 것 같습니다. 꼭 배워야 하는 기술인 것 같습니다.|경매 얘기 너무 재미나요. ㅎㅎ
 2탄 3탄 계속 보고 싶어요. ㅎㅎㅎ
.. 
찐이시네요. ㅎㅎㅎ|저도 이분한테 경매 배움요|핵심만  콕 짚어주시는 설마님~~~~^^
멋지십니다!|영상 잘 보았어요
즐거운 하루 되세요!|웃는게 귕여우십니닷|역시 경매의 신 설마님!!!!!👍👍|무주택은 괜찮은데 다주택자가힘듦ㅎ수도권경우|설마님 팬이에욤! 좋은 내용 감사해요.
또 콜라보 해주세요~|앗!!!!! 쌤을 여기서 뵙네요 ㅎㅎㅎㅎㅎ|찐고수님이 출연하셨네요~
허황된 투자보다 실질투자를 추구하시는분으로 유명한분이죠..
좋은정보 감사합니다^^
자주 출연좀 해주세요~~|우왕~~~  설마님을 신사임당님 유튜브에 보
다니, 너무 반갑습니다! "" 경매는 낙찰이 아니고  수익이다  "" 라는  깨우침을 알려주신 선생님^^|어제 서민갑부 안정일님이 쓰신 경매관련 책 샀는데 ㅎㅎ|헉. 설마쌤을 여기서 보다니... 🙋‍♀️ 신기방기|어휴 상당히 도움 됐네요^^|어. 이분 찐이다.. 더 들려줘요🥺|고수님 여기 나오시네요|오~~이분몇년전에 서민갑부에 나오셨던분이넹^^|빌라 경매 구매하고나서 미국에 살면서도 관리 할 수 있을까요? 좋은정보 감사합니다. 실천해볼께용|서민갑부에서  뵀는데  다시보니  반갑네요.좋은 정보 감사합니다|다른 부동산 전문가님들이 애널리스트 느낌이라면 이분은 실전 트레이더의 느낌이네요 말씀에서 많은 경험이 느껴집니다 결국 주식이든,부동산이든 투자의 고수들은 잃지않는 것으로 귀결되네요 잘보고 갑니다|근데요 분당 살고 있는데 여기 30평 아이 7살때 매매가 5.5 였는데 아이가 지금 12살이고 12억 되었거든요 ...매매는 나오는데 거래는 다들 꺼리는 분위기여요|와 설마 선배님! 신사임당 채널을 나오시네요|>>>>>ㅑ 설마님 반가워요! 신사임당님 채널에서 만나뵙게 될 줄이야 ㅠㅠ
저도 이분 때문에 경매를 알게 되었죠
빛과 소금 같은 조언 잘 듣고 갑니다 :)|작년 12월에 나온 규제 대책 이후로 레버리지 이용한 투자는 불가능해진 것 아닌가요?
그래도 1억5천이면 in서울빌라 매입할수있단 말씀에 희망갖게됩니다.|경매도 요즘 싼게 아닌데 더 피터지겠네|좋은정보 감사합니다. 좋은하루 되세요|재테크는 내재산을 지키는 것이다~~감사합니다.|9채면
세금이엄청나지않아요?|경험치가 쌓인다|와 경매공부다니던게 엇그적에같은데ㅠ 넘반갑네요.|제비의 집짓기 기초공사 
구경오세요 ^^|이런 경매 하려면 다주택 임대사업자 내고 해야되는거지요? 그거 안하면 다주택자로 양도세 많이 나오는거 맞나요"
부동산 계약할 때 '이런 실수'는 하지 마세요 | 반차 4화 (부동산 드라마),부동산 계약할 때 '이런 실수'는 하지 마세요 | 반차 4화 (부동산 드라마),최초 공개: 2021. 6. 11.,http://www.youtube.com/watch?v=55osn87i7TQ,"조회수 116,587회","좋아요 2,499개",싫어요 51개,"반차 5화~8화 4편 추가 제작이 확정 됐습니다! 출연자 공개 모집도 커뮤니티 글을 통해 공지드릴 예정이니 구독과 알림설정 해두시면 도움이 되시지 않을까 생각됩니다^^

감사합니다 🙏

반차 1화 부터보기 :  https://youtu.be/TYD9TIGl3bE|남자 배우 섭외 너무 잘하신 것 같아요 아주 울화통이.......ㅋㅋㅋㅋㅋㅋ|아 남편 역할 진짜 해맑고 사람빡치게하네요 거기서 우리예산얼마먀고 호로록 다 불어버리면 어카냐고|와...몰입해서 봤다..마지막 ""안살께요"" 이말 때문에.. 오늘밤 편하게 잘수있을꺼같다..|드라마에선 중개인이 아빠 친구라 그렇지..  ㅠㅜ
현실이면 좋다고 밀어붙여서 계약 끝나버렸지...|07:14  예산이 얼마냐는 질문에 3억 5천을 외치는 남주의 모습에 밤고구마 백만개를 삼켰습니다.|몰입도 죽이네요 
중개소 사장님 연기력 무엇|여주 그냥 결혼을 안하면 안되요? 남편 사고칠거같은데.... ㅎㅎㅎ|똘똘한 여자친구 잘 둬서 인생 구제했다. 남편아.. 평생 와이프한테 잘해라.|와 이게 뭐라고 
뻔히 드라마 인거 알면서도 살까봐 심장이 쫄깃쫄깃 했어요 ㅋㅋㅋㅋㅋㅋㅋㅋㅋㅋ|소름돋아ㅜㅜ내가 당했던 수법 그대로잖아ㅜㅜㅜㅜ중개인 꼬실때랑 매도인 도장들고 다 불러 앉았을때 가격 달라짐ㅋㅋㅋㅋㅋㅋㅋ우야무야 저대로 도장찍은 호구 나야나ㅜㅜㅜㅜ|그.. 남자랑도.. 안살았으면 ㅎㅎㅎ|연기는 물론 배우들 옷 차림새, 들고다니는 가방까지 '고증'이라 할만함 ㅋㅋㅋㅋㅋㅋㅋㅋㅋㅋㅋㅋ|남자분 연기지만 너무 짜증난다 ㅋㅋㅋㅋ 저런 배우자 만나면 어휴...옆에서 눈치없이 3억5천 얘기하고;|남친 진짜 섭외력 미쳤다 ㅋㅋㅋㅋㅋㅋ 존'나 답답해 진짜 ㅋㅋㅋㅋㅋㅋㅋㅋㅋ 입좀 다물고 있으면 좋겠어ㅋㅋㅋㅋㅋㅋㅋㅋㅋ|친구아들 하나 살려주려는데 자꾸 스스로 죽으려하네 ㅋㅋㅋㅋㅋㅋㅋㅋㅋㅋ|아무래도 여자주인공이 사회생활 연륜으로 눈치챘나봐요~~~~ 역시 !!|여주가 팀장 승진했다는게 복선이었던듯.
사회생활 할만큼 했고 호락호락하지 않은 성격...|아는 사람이 사기친다는 진리. ㅎㅎ|호구예비신랑 최소 전생 이순신 옆집에는 살았네|4:37 내용에 디테일이 ㅋㅋㅋㅋ
도장 없으면 싸인으로 하라고 하고 ㅋㅋㅋ
막판에 집 사는 줄 ㅋㅋㅋㅋㅋ|7:21 오늘의 디이이이이입빡 포인트......하............열불열불|남자배우 망설이는 연기 진짜 ㅋㅋㅋㅋ
국내 원탑인듯 ㅋㅋ|진짜 저희도 부동산 계약할때 딱 저랬는데..지금 생각해보니..호구도 호구도 그런호구 없었던듯..여주 넘 똑똑해요..아주 제가 배우고 싶네요..😍😍😍💜💜💜💜|드라마인데  사인할까봐 두근두근 ...어쩌누.. 꿀잼이예요..신사임당님 드라마 어디서 본거 같기도 하구요 ㅋ|생각보다 조회수가 안나오지만 타 드라마보다 현실적이어서 경쟁력이 있습니다. 처음 이 채널처럼 졸꾸하시면 입소문으로 좋은 결과 나오실 거에요.!!|근데 보통 아무것도 모르는 남자들이 저래요. 고로 집살땐 마누라말 들어야 한다|뭔데. 태양의 후예보다 재밋어..|와 그래도 마지막 결정이 숨통 틔여주네요 ㅋㅋㅋ 남주가 호구 연기 너무 잘하네요 ㅋㅋㅋ|중개인 아저씨가 솔직하게 이유 말해줬음 좋을 텐데|이야.. 새신랑이 법없이도 살사람이네 ㅋㅋㅋㅋㅋㅋ|외진빌라에 인테리어가 1억이래ㅋㅋㅋㅋㅋㅋㅋ진짜
부린이들 믿겠다?|여자가 촉이 좋네 집 문제는 여자한테 맡기세요|여배우님이 넘 이뻐요 청순 그 자체 🥰|진심 부동산 스릴러... 쫄깃쫄깃 아주 서늘합니다 ㅋㅋㅋㅋㅋㅋ|드라마보다 더 재밌는 드라마~ 디테일 하나하나가 진짜 대박입니다 연출이 누구신지 우와~~|싸인 할까봐 심장터지는 줄~|다음편이 넘 기대돼요~~🙏🙏🙏
빨리 금요일이 왔으면 좋겠습니다♡|7:21 안 사야될건 맞지만 .. 사야될 물건도 남자들이 저러더라구요... 모든패를 오픈 ㅋㅋ|마지막에 안살께요 안나왔으면 다음주까지 못기다리고 속터져 죽었을듯|아 결말이...😵 배경음악까지 쫄깃쫄깃  아는선배에 사연보내주세요!!|남자캐릭터 진짜...와 후~심호흡|정말 재밌게 봤네요.. 넷플릭스 연재 각입니다!! 추가 제작 나온다니
넘 좋아요~^^|빌라를 3억이나 주고 사는 바보가 있나보구나!!
50~60대 노후자금 다 만들어놓고 한적하고 깔끔한 신축빌라에서 여유있는 노후를 보낼 요량이 아니하면, 이제 막 사회생활 시작하는 20~30대가 사는순간 옆에 아파트 가격 급등하는 것 바라보며 집 다 삭이갈 때까지 오르는 커녕 제자리만 있어도 다행인 빌라에 3억이나 몰빵하고 산다는 건, 엄청난 기회비용의 낭비일 뿐이라 생각한다.|아니 연기를 왜케 잘하시죠들 ㅎ|와 진짜 남주 아......누가 꿀밤 한대만 때려줘요 아니 그냥 말을 못하고 있도록 해줘요 제발|앗 5화를 보게 만드는 담화를 보고싶게 만드는 엔딩씬 ~~~~ 카페베네 로고를 보았음. 김조한의 엔딩송이 흐르는~~~|12:24 크.. 마지막에 소름!

부동산 경험 별로없을 사회초년생 및 청년들에게 이렇게 간접적으로나마 도움주셔서 감사합니다 :)|부동산 드라마가 이렇게 박진감 넘칠 수 있다니|와씨 남편 ㄹㅇ 개발암이네ㅋㅋㅋㄱ 포스트조충범이다 와ㅋㅋㅋㅋ 연기잘하누|아 역시 피디님 ㅋㅋㅋㅋㅋ 너무 연출 잘하셔|와.. 거기서 드랍하기 쉽지 않은데.. 현실에서 가능하신분?|남편저거 아오 답답이네 저거|빌라 ㅅ ㅏㅈ ㅣ ㅁ ㅏ.....|부동산 스릴러 ㅡㅡ^ 너무재밌게 쟐봤습니다|배우님들도 꽉찬 연기 감사해요
저 드라마도 안보는 주부인데 챙겨서 봐요...밥 차리고 볼께요 두근두근|마지막 소름이네 ㄷㄷㄷ|속으로 제발 싸인하지마 싸안하지마 수도없이 말했는데, 싸인 안해서 다행이네요ㅎㅎ|보고싶은데 안보고싶어요ㅠㅠㅠㅠㅠㅠ 무서워요ㅋㅋㅋㅋㅋㅋㅋㅋ|휴 다행이야 사는 줄 알고 조마조마 ㅠㅠ|뭐야 이렇게 끝나는건줄 알고 허탈했는데 4편더 제작확정?ㅋㅋㅋ 굳굳|휴 속이 다 편하네|와~~~사는 줄 진짜 잘했다.|여자배우님의 연기력이 실감납니다~^^|현실반영 미친듯…|펜트하우스보다 재밌다 다음주까지 어떻게 기다리지ㅠ|이번주 5 화 안나오는건가요~~~~~~~ 오메ㅠㅠ|숨멎는줄알았네ㅠㅠ안살거알았찌만 혹시나 살까봐ㅠㅠㅠㅠㅠㅠㅠㅠㅠㅠㅠㅠㅠㅠㅠㅠㅠㅠㅠㅠㅠㅠㅠ잘했다여주야|와 대박사건 ㄷㄷㄷㄷㄷ
남자 진짜 한대 치고싶다 와 ㄷㄷㄷㄷ|와~~ 시나리오 쥑이네요. 빠져든다. 제발 하지마 하지마! 이러고 있는 나를 발견 ㅋㅋㅋ 
저 이거 그냥 안살래요^^|이건 진짜.. 와... 진짜 와....|재테크하려고 구독했는데 이 드라마가 젤 재밌당ㅋㅋㅋㅌㅌㅌㅋㅋㅋㅋㅋㅋ 신사임당님 유튜버하면안돼!! 드라마PD하셔야합니다!!!!!!!!!!!!!!!!!!!|명의가 여주여서 드랍 할 수 라도 있었지
남주였으면…ㅋㅋㅋㅋ 싸인갈기고 바롴ㅋㅋ|와... 마지막 멘트없었으면 싫어요 누를뻔했어 ㄷㄷ|보는내내 조마조마 반차4회 몰입도최강 ㅋㅋ|마지막 장면 뭐지.. 눈물나옴 ㅋㅋ 다행이다 진짜로 다행이야|내용도 재밌고 연기들도 잘 하시고. 특히 여배우님 너무 예쁘고 매력적이시네요.|보다 핸폰 밧데리 나간줄... 다음화 기대됩니다:)|남자를 너무 ㅃㄷㄱㄹ로 표현하신거 아닌가요.. 라고 하면서도 제가 저럴까 두렵습니다ㅋㅋ|부동산 사장님 연기가 돋보입니다"
